reviewId,userName,content,score,thumbsUpCount,at,appVersion,bank_name,bank_key,country,scraped_at
013aef53-1a94-41e7-9fb9-b9cde9375f6f,Julianah Kanyingi,I can barely make any transaction. It loads forever 🤦‍♀️🤦‍♀️🤦‍♀️Switch on and off the data still 🤦‍♀️🤦‍♀️🤦‍♀️I can get past the log in button !!!!,1,0,2026-02-27 18:16:05,1.5.1,KCB Bank,kcb,Kenya,2026-03-27 17:20:01.514461
41207f97-7137-4cf1-82fd-4018002b25bf,John Agutu,One of the best mobile banking apps that I've interacted with. Kudos for the great work,5,1,2026-03-05 09:01:46,1.5.1,KCB Bank,kcb,Kenya,2026-03-27 17:20:01.514461
198b535f-f535-4b88-86fa-1be9a8544b54,Michael Mmbeye,Too many steps to access funds. Failed me on a few occassions. Back to the old app.,1,0,2026-02-27 20:02:21,1.5.1,KCB Bank,kcb,Kenya,2026-03-27 17:20:01.514461
53c60974-4d20-41c9-bd77-9093dadf0aeb,KABARAKA ALEXIS,your app is becoming slow.loading for too long and not opening. can you rectify the mistake.,3,0,2026-02-27 15:55:32,1.5.1,KCB Bank,kcb,Kenya,2026-03-27 17:20:01.514461
0d864c33-323c-4a73-9710-4fc5a85dbd99,evans chauro,"I have used this app and I make these observations and hopefully they will get addressed. 1. The app is slow , too slow when logging in. 2. This new app does not have the feature of viewing transactions for the whole month in terms of percentage inflow and outflow like the previous one. 3. this new app only gives a statement of the very day only. I have tried referring to previous days, nothing coming. all the above makes it very useless unlike the previous one.",1,0,2026-03-15 22:18:23,,KCB Bank,kcb,Kenya,2026-03-27 17:20:01.514461
4fe3747c-b4dd-48aa-af00-754ce761a6c9,vinny b,good app to enhance easy transaction,5,0,2026-03-13 17:36:26,1.5.2,KCB Bank,kcb,Kenya,2026-03-27 17:20:01.514461
